{
  "$schema": "../schema/operation-v2.schema.json",
  "draft": {
    "blockers": [
      {
        "code": "empty_sample",
        "detail": "The observed tenant response was empty and cannot prove an item schema.",
        "evidence": "evidence/probe/20260808T205459Z_report.report_confmetric_permission.list.yaml",
        "status": "open"
      },
      {
        "code": "response_schema_unverified",
        "detail": "No response field is approved for exposure; response shape and item types remain unverified.",
        "evidence": "src/gravity_insight/census/data/route-response-fields.json#/routes/156",
        "status": "open"
      }
    ],
    "candidate_fields": [
      {
        "classification_reason": "frontend_static_consumer_unreviewed",
        "expose": false,
        "path": "data.list",
        "presence": "unknown",
        "privacy_classification": "manual_review",
        "types": [
          "unknown"
        ]
      },
      {
        "classification_reason": "business_metadata_name_pattern",
        "expose": true,
        "path": "data.page_info.page",
        "presence": "observed",
        "privacy_classification": "non_sensitive",
        "types": [
          "integer"
        ]
      },
      {
        "classification_reason": "business_metadata_name_pattern",
        "expose": true,
        "path": "data.page_info.page_size",
        "presence": "observed",
        "privacy_classification": "non_sensitive",
        "types": [
          "integer"
        ]
      },
      {
        "classification_reason": "business_metadata_name_pattern",
        "expose": true,
        "path": "data.page_info.total_number",
        "presence": "observed",
        "privacy_classification": "non_sensitive",
        "types": [
          "integer"
        ]
      },
      {
        "classification_reason": "business_metadata_name_pattern",
        "expose": true,
        "path": "data.page_info.total_page",
        "presence": "observed",
        "privacy_classification": "non_sensitive",
        "types": [
          "integer"
        ]
      }
    ],
    "coverage_reference": {
      "coverage_path": "src/gravity_insight/census/data/coverage.json",
      "json_pointer": "/routes/156",
      "method": "POST",
      "path": "/report/api/v3/confmetric/permission/list/",
      "route_index": 156,
      "route_sha256": "0d32d3dd39a340c15c2bec6c49b69082f2a99fcb94db24ac0df3c8c638e73c2f"
    },
    "generated_at": "2026-08-08T20:23:09Z",
    "manual_review_fields": [],
    "probe_evidence": [
      {
        "conclusion": "local_or_parent_inconclusive",
        "method_verified": false,
        "pagination_verified": false,
        "parent_resolved": false,
        "path": "evidence/probe/20260808T205323Z_report.report_confmetric_permission.list.yaml",
        "probed_at": "2026-08-08T20:53:23Z",
        "projected_schema_fingerprint": null,
        "raw_schema_fingerprint": null,
        "successful": false
      },
      {
        "conclusion": "inconclusive_empty",
        "method_verified": false,
        "pagination_verified": true,
        "parent_resolved": false,
        "path": "evidence/probe/20260808T205459Z_report.report_confmetric_permission.list.yaml",
        "probed_at": "2026-08-08T20:54:59Z",
        "projected_schema_fingerprint": null,
        "raw_schema_fingerprint": "7c58ed2c08c62403763f03bf84baabf2f6609efc6064f87aa03b35d9b739c9ea",
        "successful": false
      }
    ],
    "promotion_gate": {
      "eligible": false,
      "missing": [
        "empty_sample",
        "response_projection",
        "response_schema_unverified",
        "successful_probe"
      ]
    },
    "route_evidence": {
      "business_module": "报表",
      "callers": [
        "n"
      ],
      "contract_family": null,
      "cost_reason": "dynamic path or complex query/report semantics",
      "estimated_implementation_cost": "高",
      "first_occurrence": {
        "column": 26936,
        "file": "raw/web.gravity-engine.com/assets/Role-BccHVQip.js",
        "line": 1,
        "offset": 26935,
        "url": "https://web.gravity-engine.com/assets/Role-BccHVQip.js"
      },
      "method": "POST",
      "method_certainty": "high",
      "method_evidence": [
        "same_request_options"
      ],
      "parameter_contract": {
        "call_sites": [
          {
            "call_offset": 30134,
            "column": 26936,
            "evidence_kind": "load_call",
            "file": "raw/web.gravity-engine.com/assets/Role-BccHVQip.js",
            "line": 1,
            "route_offset": 26935
          },
          {
            "call_offset": 57572,
            "column": 54427,
            "evidence_kind": "load_call",
            "file": "raw/web.gravity-engine.com/assets/Role-BccHVQip.js",
            "line": 1,
            "route_offset": 54426
          }
        ],
        "contract_confidence": "high",
        "learned_parameters": [],
        "required_semantics": "frontend_observation_only",
        "route": {
          "method": "POST",
          "path": "/report/api/v3/confmetric/permission/list/"
        },
        "source": "src/gravity_insight/census/data/route-params.json",
        "status": "extracted",
        "top_level_parameters": [
          {
            "confidence": "high",
            "default_observed": false,
            "location": "body",
            "name": "filters",
            "path": "$.filters",
            "presence": "observed_always",
            "types": [
              "array"
            ]
          },
          {
            "confidence": "high",
            "default_observed": true,
            "location": "body",
            "name": "page",
            "path": "$.page",
            "presence": "observed_always",
            "types": [
              "integer"
            ]
          },
          {
            "confidence": "high",
            "default_observed": true,
            "location": "body",
            "name": "page_size",
            "path": "$.page_size",
            "presence": "observed_always",
            "types": [
              "number"
            ]
          }
        ]
      },
      "path": "/report/api/v3/confmetric/permission/list/",
      "promotion_level": null,
      "promotion_platform": null,
      "semantic_confidence": "medium",
      "semantic_evidence": [
        "read_action_path_token"
      ],
      "status": "uncovered_read",
      "ui_texts": [
        "平台通用"
      ]
    },
    "status": "draft"
  },
  "manifest_order": 10000,
  "operation": {
    "action": "list",
    "auth_profile": "gravity_authorization",
    "block_reason": "draft blockers: empty_sample, response_schema_unverified",
    "contract_version": 1,
    "description": "Draft catalog entry inferred from census route POST /report/api/v3/confmetric/permission/list/; request binding, pagination, and response projection remain unverified.",
    "domain": "report",
    "effect": "read",
    "examples": [],
    "executable": false,
    "input_fields": {
      "filters": {
        "description": "Frontend-observed candidate from route-params.json (confidence=high, presence=observed_always); presence describes frontend calls and is not a server-required declaration.",
        "item_type": "object",
        "type": "array"
      },
      "page": {
        "default": 1,
        "description": "Frontend-observed candidate from route-params.json (confidence=high, presence=observed_always); presence describes frontend calls and is not a server-required declaration.",
        "type": "integer"
      },
      "page_size": {
        "default": 5000.0,
        "description": "Frontend-observed candidate from route-params.json (confidence=high, presence=observed_always); presence describes frontend calls and is not a server-required declaration.",
        "type": "number"
      }
    },
    "live_probe": {
      "enabled": false,
      "inputs": {
        "filters": [],
        "page": 1,
        "page_size": 5000.0
      }
    },
    "operation_id": "report.report_confmetric_permission.list",
    "pagination": {
      "kind": "none",
      "list_path": "",
      "page_field": "",
      "page_info_path": "",
      "page_size_field": "",
      "total_page_field": ""
    },
    "path_template": "/report/api/v3/confmetric/permission/list/",
    "platform": null,
    "privacy_policy": {
      "classification": "configuration",
      "redact_fields": [
        "authorization",
        "access_token",
        "token",
        "cookie",
        "password",
        "secret",
        "refresh_token",
        "session_token"
      ]
    },
    "provenance": {
      "applied_overrides": [
        "frontend_route_parameter_contract"
      ],
      "family": null,
      "platform": null,
      "source_files": [
        "drafts/report.report_confmetric_permission.list.json"
      ]
    },
    "request": {
      "body_fields": [
        "filters",
        "page",
        "page_size"
      ],
      "defaults": {
        "page": 1,
        "page_size": 5000.0
      },
      "fixed_body": {},
      "fixed_query": {},
      "path_fields": [],
      "query_fields": []
    },
    "required_parent": [],
    "resource": "report_confmetric_permission",
    "response_projection": {
      "data_keys": [
        "page_info"
      ],
      "dynamic_item_fields": [],
      "item_keys": [],
      "known_omitted_data_keys": [
        "list"
      ],
      "required_data_keys": []
    },
    "semantic_error_rules": [],
    "stability": "experimental",
    "upstream_method": "POST"
  },
  "source_schema_version": 2,
  "target_manifest": "report.json"
}
